{
  "schema_version": "lena_video_artifact_v1",
  "artifact_type": "lena_video_hpe_v1",
  "artifact_id": "lena_video_2026_08_03_spacex_launch_001_hpe_v1",
  "property_id": "lena",
  "video_id": "lena_video_2026-08-03_spacex_launch_001",
  "governed_date": "2026-08-03",
  "created_at": "2026-08-02T22:32:00Z",
  "generator_version": "lena_video_dataset_author_v1",
  "upstream_artifacts": [
    {
      "artifact_id": "lena_video_2026_08_03_spacex_launch_001_spec_v1",
      "sha256": "8ae14e0d64c929db8cdd1f3c4c7e833d3617f9d26521e81df9c3bd538900d3a1"
    }
  ],
  "anticipation": "Before frame zero Lena already faces the distant launch corridor with her weight slightly forward, lips softly parted, shoulders loose, and a held inhale ready to release when the rocket appears.",
  "timeline": [
    {
      "start_ms": 0,
      "end_ms": 2000,
      "action": "The rocket clears the distant horizon; Lena tracks it immediately, releases the held breath, and her eyebrows lift before her smile begins.",
      "body_movement": "Her chin rises about five degrees and her upper torso inclines forward without locking her knees.",
      "meaningful_displacement_cm": 3,
      "gaze_target": "the distant ascending rocket beyond camera-left",
      "expression": "focused_anticipation",
      "blink_count": 1,
      "breathing": "held inhale releases into a quiet, visible exhale",
      "weight_transfer": "balanced stance shifts subtly toward the balls of both feet",
      "gesture_initiation": "right fingers uncurl beside her thigh as recognition begins",
      "gesture_completion": "right hand separates naturally from her leg",
      "recovery": "shoulders remain relaxed after the initial startle",
      "camera_relationship": "she remains primarily launch-focused while her profile and both eyes stay readable to the companion camera",
      "provider_prompt_cue": "Rocket clears the far horizon. Lena releases a held breath; brows lift before her smile, chin rises five degrees and torso shifts three centimeters forward. Gaze tracks rocket camera-left; one blink, weight moves to forefeet, right fingers uncurl and hand clears thigh, then shoulders recover loose."
    },
    {
      "start_ms": 2000,
      "end_ms": 4000,
      "action": "Recognition becomes delight; Lena takes one short half-step toward the view and turns her shoulders just enough to share the moment with the person filming.",
      "body_movement": "Her left foot advances twelve centimeters, hips follow, and her torso rotates about fifteen degrees toward the phone.",
      "meaningful_displacement_cm": 12,
      "gaze_target": "briefly the companion behind the smartphone, then back to the rocket",
      "expression": "open_delight",
      "blink_count": 1,
      "breathing": "easy inhale accompanies the smile without a gasping loop",
      "weight_transfer": "weight transfers from right foot to the planted left foot",
      "gesture_initiation": "right elbow bends and forearm begins to lift toward the launch path",
      "gesture_completion": "forearm reaches chest height with the wrist still relaxed",
      "recovery": "the torso settles over the new stance instead of continuing to drift",
      "camera_relationship": "her quick shared glance acknowledges the camera operator without turning the shot into a pose",
      "provider_prompt_cue": "Delight opens. Lena takes one twelve-centimeter half-step, transfers weight right-to-left, and turns shoulders fifteen degrees toward the phone. After one blink she gives the companion a quick glance, returns gaze to rocket, inhales easily, and lifts her relaxed right forearm to chest height before settling."
    },
    {
      "start_ms": 4000,
      "end_ms": 6000,
      "action": "Lena completes one clear pointing gesture toward the climbing rocket, follows its path with her eyes, and lets delight broaden into genuine awe.",
      "body_movement": "Her right forearm extends on a shallow diagonal while her head and sternum rise with the rocket; the left hand stays loose.",
      "meaningful_displacement_cm": 15,
      "gaze_target": "the small bright rocket and expanding distant plume",
      "expression": "bright_awe",
      "blink_count": 0,
      "breathing": "a natural exhale softens the jaw as the gesture reaches full extension",
      "weight_transfer": "weight remains grounded over the left foot with the right heel light",
      "gesture_initiation": "right index finger extends only as the forearm approaches the target line",
      "gesture_completion": "the pointing line becomes fully readable, holds briefly, then the index finger relaxes",
      "recovery": "right elbow begins to soften before the beat ends",
      "camera_relationship": "the gesture leads the viewer from Lena to the distant rocket while her face remains unobstructed",
      "provider_prompt_cue": "Delight becomes bright awe. Grounded on left foot with no blink, Lena raises chin and sternum, extends right forearm fifteen centimeters and completes one readable point; index finger extends only at target, holds briefly, then relaxes as elbow softens. Her face stays clear; left hand remains loose."
    },
    {
      "start_ms": 6000,
      "end_ms": 8000,
      "action": "Lena lowers her hand, settles her stance, and watches the successful climb with a quieter open smile and one final amazed glance toward her companion.",
      "body_movement": "Her right arm returns to her side, shoulders lower, and her torso eases back to a stable upright position.",
      "meaningful_displacement_cm": 5,
      "gaze_target": "the rocket first, then a final half-second glance toward the companion",
      "expression": "settled_wonder",
      "blink_count": 1,
      "breathing": "one calm recovery inhale keeps the chest and shoulders physically alive",
      "weight_transfer": "weight redistributes evenly across both feet",
      "gesture_initiation": "right elbow folds to begin the return from the completed point",
      "gesture_completion": "right hand reaches a relaxed neutral position beside the shorts",
      "recovery": "movement resolves cleanly with no frozen end-frame grin or repeated gesture",
      "camera_relationship": "the closing glance includes the camera operator in the shared awe while the launch remains the visual context",
      "provider_prompt_cue": "Lena lowers the completed point five centimeters to her side, redistributes weight evenly, drops shoulders, and returns upright with one blink and calm recovery inhale. She watches the safe climb with settled wonder, then gives her companion a final half-second glance; motion resolves without a frozen grin or repeat."
    }
  ],
  "final_settled_state": "At exactly eight seconds Lena is balanced, breathing naturally, right arm relaxed, face fully readable, and still watching the safely ascending distant rocket with settled wonder."
}
